{
  "$schema": "https://json-schema.org/draft/2020-12/schema",
  "$id": "https://davidlybeck.com/schemas/theme-pack-v1/theme.schema.json",
  "title": "Portfolio Theme Pack v1 manifest",
  "type": "object",
  "properties": {
    "$schema": {
      "const": "portfolio-theme-pack/v1"
    },
    "id": {
      "type": "string",
      "pattern": "^[a-z][a-z0-9]*(?:-[a-z0-9]+)*$",
      "maxLength": 48
    },
    "label": {
      "type": "string",
      "minLength": 1,
      "maxLength": 64
    },
    "version": {
      "const": 1
    },
    "tiles": {
      "const": "tiles.json"
    },
    "presentation": {
      "const": "presentation.json"
    },
    "background": {
      "type": "array",
      "minItems": 1,
      "maxItems": 4,
      "items": {
        "type": "object",
        "properties": {
          "asset": {
            "type": "string",
            "pattern": "^assets/.+\\.svg$",
            "maxLength": 200
          },
          "depth": {
            "type": "number",
            "minimum": 0,
            "maximum": 1
          }
        },
        "required": [
          "asset",
          "depth"
        ],
        "additionalProperties": false
      }
    },
    "selection": {
      "type": "object",
      "properties": {
        "enabled": {
          "type": "boolean"
        },
        "randomEligible": {
          "type": "boolean"
        },
        "randomWeight": {
          "type": "integer",
          "minimum": 1,
          "maximum": 100
        }
      },
      "required": [
        "enabled",
        "randomEligible",
        "randomWeight"
      ],
      "additionalProperties": false
    }
  },
  "required": [
    "$schema",
    "id",
    "label",
    "version",
    "tiles",
    "presentation",
    "selection"
  ],
  "additionalProperties": false
}
