{
  "$schema": "portfolio-theme-pack/v1",
  "id": "planets",
  "label": "Planets / Constellation",
  "version": 1,
  "tiles": "tiles.json",
  "presentation": "presentation.json",
  "background": [
    {"asset": "assets/background.svg", "depth": 0.06},
    {"asset": "assets/background-near.svg", "depth": 0.18}
  ],
  "selection": {
    "enabled": true,
    "randomEligible": true,
    "randomWeight": 1
  }
}
