{
  "$schema": "portfolio-theme-pack/v1",
  "id": "botanical",
  "label": "Botanical Collection",
  "version": 1,
  "tiles": "tiles.json",
  "presentation": "presentation.json",
  "background": [
    {
      "asset": "assets/background.svg",
      "depth": 1.0
    }
  ],
  "selection": {
    "enabled": false,
    "randomEligible": false,
    "randomWeight": 1
  }
}
